{
  "$schema": "https://json-schema.org/draft/2020-12/schema",
  "$id": "https://souindustrial.com/schemas/release-evidence-envelope.v1.schema.json",
  "title": "Release Evidence Envelope v1",
  "description": "Portable structural authority for release evidence. Cross-field arithmetic and verdict prerequisites live in tools/validation/Test-ReleaseEvidenceEnvelope.ps1.",
  "type": "object",
  "additionalProperties": false,
  "required": [
    "contract_version",
    "task_id",
    "gate_id",
    "suite_id",
    "environment",
    "profile",
    "started_at",
    "completed_at",
    "total_count",
    "executed_count",
    "passed_count",
    "failed_count",
    "skipped_count",
    "unapproved_skip_count",
    "skip_reasons",
    "commit_sha",
    "evidence_paths",
    "verdict"
  ],
  "properties": {
    "contract_version": {
      "const": "1.0",
      "description": "Frozen contract identity. A change here is a deliberate revision, never an in-place edit."
    },
    "task_id": {
      "type": "string",
      "minLength": 1,
      "description": "The backlog task that produced this evidence."
    },
    "gate_id": {
      "type": "string",
      "description": "Gate that produced the evidence. May be empty when suite_id is populated."
    },
    "suite_id": {
      "type": "string",
      "description": "Suite that produced the evidence. May be empty when gate_id is populated."
    },
    "environment": {
      "type": "string",
      "minLength": 1,
      "description": "Where the run executed."
    },
    "profile": {
      "type": "string",
      "minLength": 1,
      "description": "Which profile the run executed under."
    },
    "started_at": {
      "type": "string",
      "format": "date-time",
      "description": "ISO 8601 start, with offset."
    },
    "completed_at": {
      "type": "string",
      "format": "date-time",
      "description": "ISO 8601 completion, with offset. Never earlier than started_at."
    },
    "total_count": {
      "type": "integer",
      "minimum": 0,
      "description": "Every test the producer knew about: executed plus skipped."
    },
    "executed_count": {
      "type": "integer",
      "minimum": 0,
      "description": "Tests that actually ran. A skipped test is never executed."
    },
    "passed_count": {
      "type": "integer",
      "minimum": 0,
      "description": "Executed tests that passed."
    },
    "failed_count": {
      "type": "integer",
      "minimum": 0,
      "description": "Executed tests that failed."
    },
    "skipped_count": {
      "type": "integer",
      "minimum": 0,
      "description": "Tests not executed. Every one is accounted for by a skip reason."
    },
    "unapproved_skip_count": {
      "type": "integer",
      "minimum": 0,
      "description": "Skips carrying no approval. GREEN is impossible while this is above zero."
    },
    "skip_reasons": {
      "type": "array",
      "description": "One entry per distinct reason. Counts sum to skipped_count.",
      "items": {
        "type": "object",
        "additionalProperties": false,
        "required": [
          "reason_code",
          "count",
          "approved",
          "reason"
        ],
        "properties": {
          "reason_code": {
            "type": "string",
            "minLength": 1
          },
          "count": {
            "type": "integer",
            "minimum": 1
          },
          "approved": {
            "type": "boolean"
          },
          "reason": {
            "type": "string",
            "minLength": 1
          }
        }
      }
    },
    "commit_sha": {
      "type": "string",
      "pattern": "^[0-9a-fA-F]{40}$",
      "description": "Full 40-character Git SHA. An abbreviation cannot identify what was certified."
    },
    "evidence_paths": {
      "type": "array",
      "minItems": 1,
      "items": {
        "type": "string",
        "minLength": 1
      },
      "description": "Repository-relative artifact paths. Absolute paths are not portable."
    },
    "verdict": {
      "enum": [
        "GREEN",
        "RED"
      ],
      "description": "GREEN has prerequisites that are necessary, not sufficient."
    }
  }
}
