{
  "contract_version": "1.0",
  "task_id": "T-257",
  "gate_id": "",
  "suite_id": "frontend-global-suite",
  "environment": "local-node",
  "profile": "ci",
  "started_at": "2026-09-09T09:02:15+02:00",
  "completed_at": "2026-09-09T09:06:58+02:00",
  "total_count": 12,
  "executed_count": 10,
  "passed_count": 10,
  "failed_count": 0,
  "skipped_count": 2,
  "unapproved_skip_count": 0,
  "skip_reasons": [
    {
      "reason_code": "ENVIRONMENT_NOT_AVAILABLE",
      "count": 2,
      "approved": true,
      "reason": "Browser matrix rows requiring a second engine are approved as out of scope for this gate."
    }
  ],
  "commit_sha": "9a17d3c50be82f461d7c093ab5e2740fc8163d9e",
  "evidence_paths": [
    "Frontend/reports/frontend-suite-summary.json"
  ],
  "verdict": "GREEN"
}
